{"$defs":{"PrdScopedRefV1":{"additionalProperties":false,"properties":{"prd_id":{"not":{"pattern":"[\\r\\n]"},"pattern":"^[A-Za-z0-9](?:[A-Za-z0-9._-]{0,126}[A-Za-z0-9])?$","type":"string"}},"required":["prd_id"],"type":"object"}},"$id":"anvil.state.prd-content.v1","$schema":"https://json-schema.org/draft/2020-12/schema","additionalProperties":false,"properties":{"applied_limit_bytes":{"minimum":1,"type":"integer"},"content":{"type":"string"},"content_digest":{"pattern":"^[0-9a-f]{64}$","type":"string"},"digest_algorithm":{"const":"sha256","type":"string"},"encoding":{"const":"utf-8","type":"string"},"operation_id":{"const":"state.prd.content","type":"string"},"operation_version":{"const":1,"type":"integer"},"prd_ref":{"$ref":"#/$defs/PrdScopedRefV1"},"prd_revision":{"minimum":1,"type":"integer"},"returned_size_bytes":{"minimum":0,"type":"integer"},"schema_id":{"const":"anvil.state.prd-content.v1","type":"string"},"selected_sections":{"items":{"type":"string"},"maxItems":128,"type":"array"},"source_digest":{"pattern":"^[0-9a-f]{64}$","type":"string"},"source_size_bytes":{"minimum":0,"type":"integer"},"truncated":{"const":false,"type":"boolean"}},"required":["prd_ref","prd_revision","source_digest","content_digest","source_size_bytes","returned_size_bytes","selected_sections","applied_limit_bytes","content"],"type":"object"}
